{
  "$defs": {
    "__schema0": {
      "maxLength": 512,
      "type": "string"
    },
    "__schema1": {
      "const": 1,
      "type": "number"
    },
    "__schema2": {
      "pattern": "^[a-z][a-z0-9-]{2,127}$",
      "type": "string"
    },
    "__schema3": {
      "pattern": "^[a-z][a-z0-9-]{1,63}$",
      "type": "string"
    },
    "__schema4": {
      "pattern": "^[a-z][a-z0-9-]{2,127}$",
      "type": "string"
    },
    "__schema5": {
      "exclusiveMinimum": 0,
      "maximum": 9007199254740991,
      "type": "integer"
    },
    "__schema6": {
      "additionalProperties": false,
      "properties": {
        "expiresAt": {
          "allOf": [
            {
              "pattern": "^(?:(?:\\d\\d[2468][048]|\\d\\d[13579][26]|\\d\\d0[48]|[02468][048]00|[13579][26]00)-02-29|\\d{4}-(?:(?:0[13578]|1[02])-(?:0[1-9]|[12]\\d|3[01])|(?:0[469]|11)-(?:0[1-9]|[12]\\d|30)|(?:02)-(?:0[1-9]|1\\d|2[0-8])))T(?:(?:[01]\\d|2[0-3]):[0-5]\\d:[0-5]\\d\\.\\d{3}(?:Z))$"
            },
            {
              "pattern": "^\\d{4}-\\d{2}-\\d{2}T\\d{2}:\\d{2}:\\d{2}\\.\\d{3}Z$"
            }
          ],
          "maxLength": 64,
          "type": "string"
        },
        "owner": {
          "pattern": "^[A-Za-z0-9][A-Za-z0-9._:/@-]{2,511}$",
          "type": "string"
        }
      },
      "required": [
        "owner",
        "expiresAt"
      ],
      "type": "object"
    },
    "__schema7": {
      "maximum": 1000000000,
      "minimum": 0,
      "type": "integer"
    },
    "__schema8": {
      "const": "active",
      "type": "string"
    }
  },
  "$id": "https://schemas.k-nex.dev/worker-generation-fence/v1.json",
  "$schema": "https://json-schema.org/draft/2020-12/schema",
  "additionalProperties": false,
  "properties": {
    "$schema": {
      "$ref": "#/$defs/__schema0"
    },
    "activeExecutionGeneration": {
      "$ref": "#/$defs/__schema4"
    },
    "applicationId": {
      "$ref": "#/$defs/__schema2"
    },
    "environment": {
      "$ref": "#/$defs/__schema3"
    },
    "fencingToken": {
      "$ref": "#/$defs/__schema5"
    },
    "lease": {
      "$ref": "#/$defs/__schema6"
    },
    "mode": {
      "$ref": "#/$defs/__schema8"
    },
    "promotionRevision": {
      "$ref": "#/$defs/__schema7"
    },
    "schemaVersion": {
      "$ref": "#/$defs/__schema1"
    }
  },
  "required": [
    "schemaVersion",
    "applicationId",
    "environment",
    "activeExecutionGeneration",
    "fencingToken",
    "lease",
    "promotionRevision",
    "mode"
  ],
  "title": "K-Nex Worker Generation Fence v1",
  "type": "object"
}
